{
  "uuid": "4ea39920-8bb3-4afd-99d5-ab8f4d871f13",
  "project": "test_project",
  "name": "test_edit",
  "description": "a simple job to test that task edits are broadcast correctly",
  "paused": false,
  "triggers": [
    {
      "name": "every_minute",
      "start": "2021-04-07T00:00:00Z",
      "period": "1m"
    }
  ],
  "tasks": [
    {
      "name": "step0",
      "depends": [
        "trigger/every_minute"
      ]
    }
  ]
}